{"narration_body":"# Chinese Podcast Narration\n\nConvert `大家好，这里是测试播客。本期我们聊聊一个虚构的小工具：晨间清单。它只做一件事：每天早上列出三件最重要的事。没有其他功能，也不承诺提高收入。` into narration guidance for a Chinese-language podcast. Use `a calm weekly tech digest`, `new listeners unfamiliar with productivity tools`, `8 minutes`, and `warm and unhurried`.\n\nRequirements:\n\n- Mark pacing, pauses, emphasis, speed changes, and emotional intensity by section.\n- Preserve accurate pronunciation of names, numbers, and foreign terms; list uncertain pronunciations for review.\n- Remove unnecessary written-language phrasing without changing facts, claims, or quotations.\n- Provide opening, transitions, closing, and optional intro/outro guidance.\n- Produce a TTS-ready version and human voice direction; never imitate an unauthorized real person's voice.\n\nOutput: cleaned narration, performance marks, pronunciation list, audio review checklist.","performance_marks":["opening: slow pace, warm emphasis","transition at 02:10: brief pause","closing: unhurried fade"],"schema_version":"podcast_narration_delivery.v1","uncertain_pronunciations":["晨间清单 (chén jiān qīng dān — confirm tone)"]}